{
  "created_at": "2026-09-01T12:00:00Z",
  "id": "cin_01M1E62D792S1N80V07NXVZWQ4",
  "is_locked": true,
  "project_id": "proj_01M1E62D76FNNBXXTGBQRJKN0D",
  "revision_id": "rev_01M1E62D76RATSCXCXASR9GKGC",
  "schema_version": "1.0",
  "scope": "scene",
  "scope_target_id": "scn_01M1E62D76714367YC1WWF2F3F",
  "source_role": "writer",
  "statement": "Ada must remain sympathetic even when lying"
}
